id,str_quote,bln_inactive,,
612,"This was a great workshop, because I've been so busy trying to just survive, I forgot my goals and things I wanted to do. This helped me realize I can do more, and there's so much more of life to live.",0,,
613,This is going to be for my daughter. I want her to know I was thinking about her when I made this. It is so special.,0,,
614,"The art workshop made me take a look at myself, and talk to myself, and encourage myself.  It was uplifting and empowering.",0,,
615,I was able to express myself through colors and decorating. Nobody was around to put me down or say my project was ugly. Iím satisfied with myself for the first time in four years.,0,,
616,The ìWhat Makes Me Shineî exercise literally made all the members shine by the end of the night.  Very powerful and healing.  I am honored to spread the ìAWBWî light. A newcomer was showered in love and acceptance!,0,,
617,"My client has very low self-esteem so I thought this project would be a good choice for her. When I initially described the project she told me that there wasnít anything she liked about herself.  I didnít want to put words in her mouth I suggested some things that I thought might help.  She ended up putting things about each of her children and things she likes to do and ultimately a few things she likes about herself.  In the middle of her sun she wrote a beautiful, heart-like poem.  She told me she felt relaxed and had fun while she worked.  I was so pleased with the effort she made.",0,,
618,"One thing I really like about this program is that it helps me explore the underlying feelings that I would not normally express.  Maybe itís the unconscious, but I get to dig deep and go underneath it all.",0,,
619,My personal needs flower talks about how much I love my kids and how I love to cook their favorite foods.  It also says I need a house to live in with my kids and a job to provide for them.,0,,
620,Windows continues to motivate me to taking more steps away from domestic violence.  This specific project helped me to realize my needs are important too.,0,,
621,I thought this project was very helpful to me because I realized that I am not alone in this room.  And I was being very selfish and self -centered in thinking my situation was unique. I feel that this made my mind feel a little more soothing than it normally is considering all that I am going through. I think it was fun and wonderful to get to the real me.  IT WAS COOL TO EXPRESS MYSELF.,0,,
622,Wow I didn't realize how hard it would be to know what it is I really need.,0,,
623,"I felt glad after doing this project because it made me realize that I have to work on my family communication.  Since my son was exposed to his father's abusive behavior, he sometimes acts like that. I have to be patient when correcting his misbehaviors and be strict with the discipline. I know I will accomplish that because I love my son so much; he's the reason for my life.",0,,
624,"This activity is really good for women to think about their needs. It seems everybody has a need, but there is no chance to address or deeply think about the needs they have.",0,,
625,"After doing this project, I feel I'm starting from ground zero: I'm recovering my calm, my mental health.  Iím in better condition to help my children, who I need to see smiling, and who do smile now that we are safe from the batterer. With the support Iíve received, I feel liberated and confident, ready to achieve my goals: to provide a peaceful and loving home in which my children can grow up healthy.",0,,
626,"Using no tools to form shapes except for my hands was empowering for me. Somehow, it made me feel like I am enough.",0,,
627,This workshop always helps me to deal with my feelings about domestic violence and gives me the courage to get through it.,0,,
628,Thank you for helping me reach my feelings that were hidden for so long.  For the first time in my life I am relaxed. You donít even know how much Iím thankful for that.,0,,
629,"Thank you very much for the support that this program has given me, it is a beautiful way to express my sentiments through art. I feel great with this opportunity.",0,,
630,The most rewarding moment was when a client was able to identify hidden feelings. She was also able to open up and share those feelings and put a name on it. This facilitated a counseling session which was much needed. She was able to find herself in her current situation and find a goal in the future to work towards. Staff was then able to provide better support and encouragement during the rest of her stay.,0,,
631,"The women really enjoyed this activity.  Many of them used the same quote on their painting which was ""Every end is a new beginning.""  That is where many of the women are at with their emotions right now.  They feel like they are in transition and to paint and reflect gave them encouragement that the feeling they have is normal; everyone in the group feels the same, so it's OK to feel that way.",0,,
632,I feel the workshop has helped me significantly with a lot of my self-esteem issues.  It has also helped me with feeling comfortable in my own skin.,0,,
633,They enjoyed seeing where they have been and where they are in life now and what their future will hopefully be like.,0,,
634,These sessions help me express how I can deal with these feelings that I'm holding inside. I really need not to hold in so much. I know it is not healthy and the art really releases pressure and eases stress.,0,,
635,One client has been very confused and during this project she was able to clearly express her road to self love.,0,,
636,"Clients said that they realize that they are not loving themselves enough. After this workshop, they knew, so they said that they will practice it in the future.",0,,
637,"One individual completed this project when she first came to the shelter and now, having done it again, sheís amazed at the difference.  The first map featured external goals, while the second one showed more internal objects, things of self love: ëI can't believe how much my priorities and I have changed in such a short time...í",0,,
638,"One woman's map kept leading her back to her batterer until she was finally able to ëbreak away,í and that seemed to impact the group. It showed that it is not a linear process nor an easy one but that in the end, the client still attained her goal of separation and end of the abuse.",0,,
639,"This is always a good workshop. It makes the women voice their needs, which a lot of them haven't done in years or don't know how to do.  This makes it easy for them. Thank you.",0,,
640,I didn't realize how important it is to take time for me. I didn't know I was coming up with justifications for being good to myself. This workshop was great; I feel really relaxed and good.,0,,
641,One of the participants stated that she liked how the butterfly shriveled up and turned from one side to another like if it was struggling and then at the end it unraveled and came to peace. She stated that this reminded her of herself. I thought that was a great analogy.,0,,
642,One woman that I did the Shrinky Dink project with loved it so much that she went home and bought large sheets of it to do with her kids.  She came back so excited and with tons to show me!  They loved it!,0,,
643,"One woman had been in a very abusive relationship for ten years.  We did the shrinky dinks workshop and she created two butterflies and made them into earrings.  They represented her two daughters.  She said they were free and could fly anywhere.  That workshop was such an amazing transformation for her.  It woke her up from that treacherous life.  The next day she came down with her earrings on and she looked completely different.  She had her hair down and wore bright colors instead of the black she had been limited to.  She looked completely different after that workshop.  And when she went out, people asked her where she got her earrings.  She was so proud and felt powerful doing that for herself.",0,,
644,"I liked being able to express myself about issues and feelings that I have, that I can't communicate to people.",0,,
645,"I think the workshop makes you think about your past, present and future.  That's a deep process.  But here you can think freely and honestly.  You can be very honest with yourself.",0,,
646,"This period of time brought flashbacks of their abusive experiences. Although it took them to a place of trauma, they seemed to have a better sense of self.  They were able to identify the role they took in the relationship and compared them to their role in their current and/or future relationships. ìWow, I can't believe I let him do that to me. I was able to identify with all the information provided.î",0,,
647,"This workshop helped me see all of the abuse I experienced, and to help me discover myself little by little.",0,,
648,"When I say aloud how abuse affected me, what he did, it makes it more real. And now I have to and will deal with it.",0,,
649,"Even though the pain was tremendous when going through this workshop, it was wonderfully informative.  I learned that I am not alone and there are behaviors that I never even considered abuse!",0,,
650,"You can read books and pamphlets, but I think with my hands making things. It works to wake up a part of me that was dead.",0,,
651,We don't have to put up with the abuse.  We are going forward.,0,,
652,"Some of the women wanted to believe they were ""over"" the power and control issues in their lives.  Extreme emotion was brought to the forefront.",0,,
653,This workshop has helped me show all the abuse I was in and will help me to recognize it in the future.  It has also helped me discover myself little by little.,0,,
654,I learned how to stand on my own and what to look for in a healthy relationship. I'm learning how to live on my own and find myself.,0,,
655,It helped me to keep reinforcing the thought of turning my husband away.,0,,
656,"After doing the ìFuneral of ëI Cantísî my client was finally ready to leave the abusive relationship and got a restraining order.  She kept telling me that I did this for her and I told her ëNo, it isnít me. It is you that did it.  It is this program that did it!í",1,,
657,"This was a very emotional workshop.  It was wonderful to see each woman stand in front of the group and share her ""I cantís"" and then have the others walk over to her, embrace her and reassure her that she ""can"" do whatever she sets her mind to.  The looks on their faces when they put that piece of paper through the shredder was priceless.  I saw confidence in their eyes when they turned and looked at me.  I loved doing this workshop with them because of the impact it had on each of them.",0,,
658,"I felt peace, relief, and good.",0,,
659,Very powerful workshop. The women were very honest and released a lot of fear and pain.,0,,
660,"I burned my ""I can't"" on the ocean so if the ashes ever come back, they would do good things, not harm, since ash is good for the soil.",0,,
661,"Visualizing and then burning their internal obstacles to happiness allowed many women in the program  to share their experiences, feelings and emotions for the first time.  One was inspired to verse:",,,
\,,,,
"Burning my Canítsî\
\
I can be a whole new person,\
and do anything I want.\
\
I can be stronger,\
and put pain away.\
\
I can work without worry,\
and live without excuses.\
\
I can see my friends again,\
and theyíll see how Iíve survived,\
\
I can thrive.	0
662	My picture shows all the things I felt I couldnít let go of: my ex-boyfriend who abused me physically and mentally, my drug addiction, and also my feelings.	0
663	One woman stated it was the first time she put her dreams on paper.	0
664	The women were able to express their feelings of what made it hard for them to leave the relationship and this activity brought out their strength that they were unaware of.	0
665	I like to think of the I can't's"" as a transformation into something more beautiful, rather than trying to kill it. I need to learn from my past and transform through it.",0,,,
666,"Thank You. I've been Procrastinating, and making excuses for why I cant get things done. Now I realize I can do anything I set my mind to.",0,,
667,"I have always felt like I can't get past my abuse, but this workshop helped me realize that I can.",0,,
668,It was great saying goodbye to my ëI cant's.í Now I CAN.,0,,
669,Me gusto buscar dentro y  fuera de mi. Gracias.,,,
\,,,,
,,,,
\,,,,
I liked to search inside and outside of me.  Thanks.,0,,,
670,"Thank you for giving us women the opportunity to take time to reflect on our inner being. It makes me feel good to make something that reminds me of when I was a child, it brings back memories of peace, quiet, safety.",0,,
671,[It affected me] in a good way & bad. It allowed me to express everything I've been reminded of about who I am. It was easy because I've accepted who I am. Everyday I'm someone new.,0,,
673,"I facilitated the group Inside/Outside and had a group of five women.  One of the women made her piece of paper into a layered house, and as she unfolded the house, she ìcame outî as a battered lesbian.  Her comments were that she has never done that in a group of strangers before but felt so safe and comfortable that she felt she couldóit was a very warm and loving group with lots of support and insight.",0,,
674,"One woman shared in her comments that ìThis is one of the best things I have ever done for myself... The first day here you had me draw a tree.  To tell you the truth I didnít even understand why a tree!  But after we went on and with all the classes I got it, with all the art you had us do it turns out I really understand about all the hurt Iíve been through.î... The tree became a powerful metaphor for her.  She saw the tree and trunk as her entire being.  She realized that she was a tree, either healthy or not.  That she wanted a firm trunk to protect her kids, that she needed strong roots to be her feet.",0,,
675,"One of the women in the group painted a broken stick instead of a tree.  She had been ëgivení to a man at age 12, had been abused by him and had never discussed it until this workshop.  It turned out to be a major breakthrough for her.  She shared with us that the stick represented how ëThere is hardly anything left of me.  I am broken, Iím blowing in the wind.  But there is hope.í  This workshop led her to this powerful breakthrough.",0,,
676,"Thank you for keeping this door open for people like me, who have decided to break the circle that does not allow us to flourish and grow.",0,,
677,"All of the women created unique, beautiful paintings of trees. They also depicted themselves & their children as part of nature.",0,,
678,"Part of my tree is dead, but another part is very strong and lively and draws some nutrients from the dead part.",0,,
679,I felt like a little girl swinging high in the sky trying to reach the clouds so I didn't have to go back home to the dark side.,0,,
680,My tree shows how I felt life was cut off for me and how I then started to grow again.,0,,
681,"I would like to become a strong and old tree that, no matter what anyone does to it, will be too strong to fall.",0,,
682,This is one of the best things I have ever done for myself...With all the art you had us do it turns out I really now understand about all the hurt I have been through.,0,,
683,"Like my tree, I will continue to grow.",0,,
684,"I like the process of using a tree as a focal point. Not everyone has a strong tree in their life but if you look outside yourself or at least look at me, I know my roots are deep and strong.",0,,
685,"All the women were able to share the ups and downs of their healing journey.  They showed much passion, determination, hope and love through their art and their words.",0,,
686,"What a process this workshop has been!  It's interesting to see my healing journey before my eyes ó the ups and downs, the rough spots and then the places of opening and hope and great growth.  This group helps me heal in such beautiful and deep ways.  Thank you!",0,,
687,"Today I can see danger and look at it in the eye.  No more hiding away, no more pretending I do not see it, hoping it will not exist.  Today I know I'm worth taking care of myself.",0,,
688,"Sometimes the first thing we must do is to give our fears a face so we can confront them, otherwise the unknown seems scarier then it really is.",0,,
689,Realmente es asombroso como este taller ayudo a relajarme y a identificar todos los diferentes sentimientos que han estado dentro de mi por mucho tiempo. Gracias.,0,,
690,I have learned a lot from my mistakes. I have learned not to return to my abuser. I learned the red flags of a abuser.,0,,
691,The highlight of the group was when a participant stated that it was important not to blame ourselves when we make mistakes.,0,,
692,Part one was great.  It really let me open my mind to many thoughts and let me release them on to paper.  Thank you!,0,,
693,"My primary candidate of interest was the Asian client.  Her knowledge of the English language was zero.  As she shared her Mistake Wheel project to the entire group her heightened sense of enthusiasm was maintained until the end.  It was a subject matter that sparked her interest.  She was obviously in her comfort zone.  Her philosophical view of lifeís journey challenges and obstacles was geared towards death and rebirth (growth!), versus our concept of ìproblems.î  She was thoughtful and articulate.  She grasped the concept of the Native American Mistake Wheel Beyond the scope of the project.  Language barrier and time was nonexistent.  The group experienced a ìZenî moment.",0,,
694,"One of the participants was not allowed to pick up the phone at home. Her husband would actually test her to see if she even touched the phone. After the ""Putting Myself Back Together"" workshop, she shared that her goal that day was to answer the phone if it rang. She shared the following week that she did. She answered the phone. She still couldn't call anyone herself, but she's working on it. I truly believe this program has given many of the participants in our program the courage to begin to make changes in their lives.",0,,
695,"One of the clients that participated in this workshop said that she initially didn't think much about this workshop. However, as she began to engage in the activity and really think about what she was being asked to exlore within her, she said that she thought it was incredible how something so simple as art was helping her find the hurt within her. A few days after this workshop she came in for her individual counseling, and I had her monster out on the table and she said she did not want to look at it. She mentioned what an impact this activity had had on her and that she cold not stop thinking about this monster because it opened up so many emotions in her. She was surprised because she did not expect herself to react this way due to art.",0,,
696,"I didn't get angry at the time but I'm very angry now, and I'm glad to know I can use my anger in a healthy way.",0,,
697,The two women who did the activity touched powerful reserves of anger.  We discussed how anger is a powerhouse of energy that can support one in confronting difficult challenges.  Both women came away with new respect for their anger and a bit of excitement I think.,0,,
698,Thanks for this... It was really great to focus on the future because I forget to do that. I've never been so relaxed in a group before.,0,,
699,"This was good medicine: medicine that made me relax, medicine thatís good for my heart.",0,,
700,"It was relaxing, fun, tension releasing, and it did give your mind an escape. To see the beauty out there in the world, that can be in my future.",0,,
701,This workshop helps me to find my self esteem and to be a stronger person.,0,,
702,I liked looking at the pictures in the magazines and identifying with some of the images that I chose. It was liberating.,0,,
703,"The ladies really enjoyed the meditation we did, and it helped them get into the project. They enjoyed finding the pictures that made them feel at peace and happy. We focused on finding pictures and building collages that they could look at and find their happy place: ìFinding words to go with my collage was hard, but it made me think about positive words and how I never got to hear them from him.î",0,,
704,It seemed that many of the participants really focused on making their collage a daily reminder of their dreams and goals.,0,,
705,This workshop was useful in my progress in healing from sexual assault.  It helped me in finding the courage to continue the healing process and to build healthy coping skills.  Thank you!!,0,,
706,One woman stated that the workshop gave her a sense that her future is bigger than it looks right now.  Another expressed that it made her feel good to be able to allow herself to explore her world in a more expansive way.,0,,
707,"In the beginning, I never really wanted to participate, but once we started, I really felt great and, yes, really positive. And I saw a little clearer a vision of the future.",0,,
708,"One woman shared that it was difficult for her to imagine the future as being positive.  However, once she closed her eyes and began working the clay, feeling it mold in her hands, she said,  ëFor once I can see a positive future.í",0,,
709,It felt good to pound my feelings into the clay.,0,,
710,I felt that working with my hands and closing my eyes let me feel good and gave me opportunity to express how I feel. I really enjoy making this.,0,,
711,"With each thought or expression, I feel i'm taking back a piece to the puzzle of my life.  I know the pieces are spread out but with each step it becomes closer to completion.  I enjoy being able to think and collect my thoughts alone.",0,,
712,Me gusto mucho porque nos encontramos a uno mismo y expresamos lo que sentimos tambien nuestra preocupaciones. Gracias.,0,,
713,"This made me feel good about myself.  More powerful about myself.  Helped me find out more about myself, and it's all about me. Happy.",0,,
714,"I didn't feel safe reading what I'd written, but everyone sharing their experiences validated my own.  I now can let go of judging what I write, and that feels good.",0,,
715,"I have always been told how worthless, stupid, and ugly I am.   I had never taken the time to enumerate all the positive things about me, this was wonderful.",0,,
716,The Power of I AM is great! Just ëbeingí can be good because so many of us came close to ënot beingí.,0,,
717,The women expressed who they are in the words ìI amî. One woman cried after she read all the wonderful things she said about herself because she had forgotten.,0,,
718,I feel more relaxed after each session. I express myself better through poetry & art. Thanks.,0,,
719,Gracias por todo. Me siento muy bein aqui. No puedo dar suficiente gracias por todo lo que me han ayudado.,0,,
720,"Sigan haciendo estas clases para mas personas como yo porque nos ayuda a salir adelante y a conocernos a nosotras mismas.î \
\
Continue making these workshops for people like me because it helps us to move forward and to know ourselves better.""",0,,
721,"I love how the AWBW workshops give mothers the opportunity to play and create.  When clients enter the shelter, often there is a disconnect between the mothers and their children as a result of coming from a violent home.  The AWBW workshops give the families an opportunity to not only appreciate art but one another as well.  I have seen the Warm Fuzzy workshop allow mothers and their children to enjoy and learn from each other.",,,
\,,,,
Domestic Violence Center of Santa Clarita Valley,0,,,
722,These are sooooo cute.  Can I make 4 or so more. I want to have them all over the house so I have lots of affection to give if someone needs it. Participant Age 9,0,,
723,I'd rather have warm fuzzies than cold prickles.,0,,
724,"I'm going to give my warm fuzzy to my mom, it will make her happy. Participant Age 10",0,,
725,This helped me see my feelings because I wrote them down and I had those feelings bottled up for so long.  Thanks for this.,0,,
726,"Even though the women seemed tense and talked about struggling with their feelings now, they were able to comment that they could see a better future for themselves.",0,,
727,Wow!  A very powerful workshop.  This workshop was very effective and allowed the ladies to open up and share and offer support to one another. Each spoke of rediscovering themselves after leaving the relationship.  The project made my intern cry.,0,,
728,"I have colored the head of my paper doll black.  I can't think .  Brown represents the growing impatience with the events in my life.  I don't know where I will go from here (shelter).  The color gray-weakness.  It is important for me and my children to move forward.  When I started the workshop my feelings were well ""Nothing"".  I had no prejudgement.  By finishing the workshop I felt good.",0,,
