id,str_quote,bln_inactive,,
320,Watching the piece take shape and form gave me hope for healing.,0,,
321,"When the women looked in the mirror and into their eyes, some started to cry, admitting they never had the courage to look at themselves. They recognized the pain and hurt from their pasts and this self-knowledge helped them express themselves and share in the group.",0,,
322,"I feel like a butterfly, free from my own cocoon of abuse. Able to fly on my  own. My wings are no longer clipped. Freedom feels so great.",0,,
323,This is one of the best things I have ever done for myself...With all the art you had us do it turns out I really now understand about all the hurt I have been through.,0,,
324,"Working with these teens proved to be quite a challenge. But, once again art became the bridge from us to them, from them to each other, and then, most importantly, from and to themselves.",0,,
325,"This is the best place to be in the world...relaxation, art, feeling free, and rediscovering who we are.  Thank you.",0,,
326,My son died because of domestic violence. This art group helped me say goodbye. Thank you so much.,0,,
327,AWESOME! The time I spent doing the art work has inspired me not to keep hurting. We need to move on to a better place in our lives.,0,,
981,"This workshop provided a good amount of direct DV education. The teaching component of signs of abusive relationships was very useful for our clients. Thinking about these signs as they may have been experienced, and then writing about and thinking about wants, needs, and boundaries for future relationships, and then transferring all this to the creation of the project, was an excellent way to take this knowledge about ""red flags"" and apply them to ones own personal experience.",0,,
329,The art helps women let down their walls; it helps them connect with each other in a way they donít in the groups that are just talking.  Itís easier for them to talk about their hurtful and painful experiences.  This leads them to develop empathy and understanding and connection with each other; it brings them closer.,0,,
330,"Sometimes, when you don't want to do something because you are afraid of what might happen, you might really like the outcome.  Sometimes things don't turn out the way you wanted them to, but that doesn't mean it turned out wrong.",0,,
331,"A woman who is seemingly very depressed asked if there was group today, when I told her yes she replied, ""yeeess!î The art really has some magical effect on people who are hurting, it is amazing to see.",0,,
332,"This was a great workshop, because I've been so busy trying to just survive, I forgot my goals and things I wanted to do. This helped me realize I can do more, and there's so much more of life to live.",0,,
333,I felt good after expressing the things that for so long I couldn't express. And because of this workshop I was able to so with no fear!,0,,
334,"I was angry when I arrived--I did not want to make any hearts. But I did. I love art, always have. The collage was really relaxing, revealing, and healing.",0,,
335,"My first collage expressed a lot of hurt, sadness, and being afraid of tomorrow. My new collage reflects positive words and a new beginning for me and my children. I am looking ahead with a new outlook at life.",0,,
336,"The women so flawlessly made creative expressions. They so well symbolized what they are experiencing. One of the clients created an abstract piece that was poignantly made, the staff was moved. I am continually amazed how out of one set of instructions, diverse & beautiful pieces are created.",0,,
337,The women enjoyed the process of uncovering the bright colors underneath the dark - so much like their lives.,0,,
338,Art allows me to see whatís going on with me.,0,,
339,My life before was like this black door that is closed and sad. My life now is this red door with a small window in the middle where I can see out to the world...,0,,
340,I like to draw because it helps me put my emotions on paper without words because I can then explain what is going on. Drawing helps me to better express myself than words because I donít get nervous and my emotions just flow.,0,,
341,"I just lost my kids, and spending this time working on my treasure box helped me put order to my thoughts.",0,,
342,My butterfly has transformed like I am transforming and changing.,0,,
343,I want my daughter to respect herself and know how she deserves to be treated. I want something better for her.,0,,
344,"I was reluctant to come to this art class because I'm no artist, but I'm so glad I did because now I see just how much better I feel just by getting in touch with some feelings that I had buried.",0,,
345,My tree shows how I felt life was cut off for me and how then I started to grow again.,0,,
346,Very enjoyable and satisfying for my soul. Thank you for the adventure. It is my most important day of the month. I am so grateful. I so look forward to Windows. It is my only time to relax and play.,0,,
347,"Oh, Miss Gurutej, this is the best place to be in the world. Relaxation, art, feeling free, and rediscovering who we are.  Thank you.",0,,
348,I want to be different in my future. I want to be me. I want to be heard. I know now that I deserve respect and I want it.,0,,
349,My treasure box was the most effective. Clients found it empowering to make a box containing symbols of what they dream of or value in their life. It gave them a sense of ownership of their dreams.,0,,
350,"About 3  months ago I began to hang the women's art up in the shelter. A woman approached me and thanked me, she said, ëthank you for hanging my art up, I realize how important it is to the children, but also for me. When I was a child, my mother never hung up my art and I missed that. But seeing my art up lets me know that you think what I make is special and importantí That was very special to hear as a leader and for her own process.",0,,
351,"This program is a continuing source of inspiration.  I think A Window Between Worlds motivates all of us to discover our inner artist - and for the first time some of our clients, with crayon in hand, begin to believe they can create something beautiful.",0,,
352,This workshop helped me to find words that will uplift me when I am feeling down. In order to free ourselves from violence we have to find out what causes us to stay in certain relationships and run from others.,0,,
353,"You can read books and pamphlets, but I think with my hands making things. It works to wake up a part of me that was dead.",0,,
354,"I think the workshop makes you think about your past, present and future.  That's a deep process.  But here you can think freely and honestly.  You can be very honest with yourself.",0,,
355,"The most rewarding moment was when a client was able to identify hidden feelings, she was also able to open up and share those feelings and put a name on it. This facilitated a counseling session which was much needed. She was able to find herself in her current situation and find a goal in the future to work towards. Staff was then able to provide better support and encouragement during the rest of her stay.",0,,
356,"One woman drew a hand with a wedding ring w/ blood dripping down the hand from the ring; the hand holding a broken chain, she wrote her words on the front of the picture and then said,ínow that the picture is out of me it no longer has a hold on meí.",0,,
357,"When I do the art projects, I go into another ""zone"". I feel relaxed and peaceful.",0,,
358,"When I do the art projects, I go into another ""zone"". I feel relaxed and peaceful.",0,,
359,"A very shy lady, who hardly spoke and seemed sad most days approached me and said to me, ""All week long I look forward to the workshops, I guess because I relax and enjoy and have no negative thoughts.""",0,,
360,"When my dad used to tell me to grow up and stop crying like a baby, it hurt my heart. I still don't feel like it's safe to cry.",0,,
361,My monster makes sure that nobody touches me.  He protects me and keeps me safe from people.,0,,
362,I have learned about the cycle of violence. I do not want the monster to live inside of me I am going to do everything possible to destroy those feelings.,0,,
363,"At times I feel angry but I stop to remember what I have learned at the shelter and I want to use other ways to stop my anger, I do not want to hurt anyone.",0,,
364,A 12-year-old boy shared with us that the monster would come out in him when he used to bully children at school. When he did this workshop he started to cry and acknowledge that he did not want the monster to come out anymore. He wants to learn to help others and not hurt others.,0,,
365,She's lonely and just kind of floating around. Like me and my sister.,0,,
366,My monster destroys people's feelings.,0,,
367,I didn't know there were happy monsters I thought all monsters were bad.,0,,
368,"Not only did the moms' and kids' artworks help me understand them better, the activity fostered both nonverbal and verbal group communication.  This laid the foundation for stronger group cohesion.  It also helped me understand the dynamics between each mother and her child, as well as between moms and between kids.",0,,
369,"I used different colors because I feel all mixed up.  There is a box inside that the monster lives in.  Its dark and no bright colors can come inside.  Outside the box is happiness. I keep the lid on the box where the monster lives, I have to control these feelings.",0,,
370,I think my monster needs to be happy. He needs to be encouraged by this mother and cheered to not be shy. I really liked doing this.,0,,
371,"My monster says, ëMy family is cursed, but Iím not!í",0,,
372,"I thought back to when my dad was here, a lot of bad things happened, that's what I made this for.... My mom said everyone has a good and a bad side and this is the good side of my monster and this is the bad side.",0,,
373,The girls made monsters that looked like them.  Their monsters protected them from harm.  Their monsters protected them while they were asleep.,0,,
374,A 10-year-old child drew a picture of his monster underwater and said ëwhen I get angry I feel like I am underwater and I cannot breath.í,0,,
375,My monster is angry when he's not listened to.,0,,
376,The workshop created such an incredible means through which the participants were able to express their feelings and their current situation.,0,,
377,"Nothing is ugly, everything is pretty.  And remember nothing is wrong.",0,,
378,My painting is a example of the anger I feel inside like a dark hole.,0,,
379,I like this project because we all work together.,0,,
380,"We had a great closing discussion.  The children admitted to being angry about sharing their paper with another.  After, they saw the beauty of teamwork. The children learned to work together to make a ""masterpiece.""  I was very proud of the children!",0,,
381,"I really loved painting, I didn't feel sad at all, just happy...I loved how it felt to put the paint on the paper, just relaxing...can we paint an ocean or something next time?",0,,
382,When the leader asked children how they felt when someone else was drawing on their paper. The children shared that they were a little bit nervous at the beginning but they felt better and had fun later.,0,,
383,"We had a young boy that was always troubled and withdrawn.  During a workshop called Feeling Friends participants list all their feelings on slips of paper and place them in a paper doll figure theyíve decorated.  All the feelings expressed by the boy were those of anger.  It was very intense with things like ìI am not wanted,î ìI am teasedî and ìI have no friends.î  When asked about the angry feelings he broke down, cried and finally expressed everything he was holding in all year.  He hugged us and said that he didnít want to leave. He felt that the shelter was his home and he felt safe there.  The Feeling Friend helped him to sort out his feelings, fears and allowed us to finally feel like we connected!",0,,
384,It was very rewarding to give this small family an avenue to express feelings to one another. The dad often struggles in identifying and labeling feelings with one another. This exercise provided them with an avenue to have this discussion not only in the moment but at home too.,0,,
386,The most rewarding thing with this project was the acceptance and the recognition they all gave themselves about suppressing their feelings at times.,0,,
387,"We were doing this activity with a love theme for the month of February.  All the kids sat in a circle and we read the book ëWhat is Loveí.  After this we began to talk about all the aspects of love. What does love smell like? How is it shaped? What color is it?  All the kids shared.  One stated that love is black in color.  When the whole group had shared, we talked about the ideas.  I asked Joseph why love was black.  His response was very touching.  He said, ëLove is black--black is a color with a lot of depth, just like love.í  This allowed the group to talk about how common ideas and associations to colors and emotions are not always what we think.  It was talked about with great enthusiasm and helped engage the kids.  As Joseph stated, ëThe depth of the color black can mean much more than just darkness.í",0,,
388,"Her doll was with a red dress and white hearts. In her heart she wrote love, care, books, toys. She shared with the group. She said this is me. ëI love my family, I care about others, I like to read to others because that makes me happy to share my time with the ones I love.í",0,,
389,It is half male and half female to show how they can get along together without fighting.,0,,
390,"The kids really loved this project. They were so creative in expressing how they felt and who they cherished most in their lives. The end result was incredible. We created a display in our group room with the world and all the dolls around it. I had the children decorated flowers, hearts, rainbows, etc. It was great!",0,,
391,Love is when the mean boy at schools yells at me during recess and I don't yell back at him.,0,,
392,I show love by hugging and kissing my mom good night and telling her that I love her.,0,,
393,Love is when I make my mom's bed in the morning because she gets up early to go to work and she's too tired to do it herself.,0,,
394,Love is special and natural.,0,,
395,Love is great because you never run out. Love is best when the other person loves you back.,0,,
396,"He's a good father but a bad husband so until he learns to be a good husband, I will see him as a weak man.",0,,
397,"If I let my feelings out, I won't have any feelings.",0,,
398,I feel I can speak my mind with my mask and no one will judge me because they can't see who I am.,0,,
399,My mask doesn't want to talk about what happened.,0,,
400,I want my mask to say I'm hopeful and kind.  That is who I want to be.,0,,
401,"The participants were really positive toward each other and i was amazed by their creations as were they, as well as how they applied their expressions of themselves to our conflict resolution puppet show.",0,,
402,"I was working with one child who had lots of aggression.  He really responded to the project.  We were doing the bag puppets project and he kept his hands very busy.  When he was done, he said his puppet was called ëHomie.í  He said ëHomie likes to slap people around.í  I asked him how he felt about that and he said, ëI donít like it.  Heís not MY role model.  Hitting is not the answer.í  As we talked more, he shared that when heís angry, he doesnít like to scream into a pillow to get it out.  He likes to get it out with markers and color.  It was great to get to talk about the issue of aggression with him and I could see that for him, the answer is all about the art.",0,,
403,What I enjoy most is how the art gives the children the opportunity to be children.,0,,
404,"Butterflies are me, many shades of freedom I feel today.",0,,
405,If my butterfly could fly anywhere it would be in the fresh air with her family where no one told her anything that made her scared.,0,,
406,"This butterfly is like me, it's slow at transforming, but it, and I, will get there.",0,,
407,"My butterfly is for my mom, because it started out blank and now it is full of beautiful color!",0,,
408,It was rewarding to see the children understand the idea about our life journeys and that we change and grow. They really grasped the idea and enjoyed the process. One little girl made hers into a necklace and she wears it every day.,0,,
409,"I look at my butterfly and imagine it flying high above the world, far away from violence.",0,,
410,"My butterfly will remind me to respect people, be nice, and treat them with care.",0,,
411,"A fifteen-year old made a butterfly for his mom, for everything. He said his butterfly is the symbol of freedom for his mom...",0,,
412,Pride-the kids were glowing about their creations.,0,,
413,I picked the squiggly one because I'm all over the place. The many colors are like my moods and the eyes are my watchdogs.,0,,
414,My journey was amazing.,0,,
415,"My future will have no fighting and my mom will not have to work hard, I will take care of her.",0,,
416,"If my butterfly could fly anywhere it would be all over the world, it's a good feeling to feel free and no one can control you.",0,,
417,"She told me she wrote words on her butterflies (5) that she has never heard from anyone. She said ëMy journey is to feel love, comfort, laughter, acceptance and beautiful.í",0,,
418,"A 10 year old girl wrote on her butterflies ""peace, love, share."" When she shared her butterflies with the group, she told us about how she wants her father to love her the same way as he loves her brother.",0,,
419,"A butterfly has to move sometimes and so do people.  We had to move because of my mom's boyfriend, but it's for the better.",0,,
420,"The Shrinky Dink Journey Butterfly workshop had a big impact on one child. When I told her this was for her, she said no one had ever given her anything before.  She was also happy to discover that she was not the only one that had been from place to place, like a butterfly.",0,,
421,"After the Debut CD project, one of the teen moms who had been very dependent on her boyfriend said, ëNever have a baby because you are lonely.í  This was a major moment of self-awareness for her.",0,,
422,I want to make one for each part of myself.,0,,
423,"The CD art activity was such a success! The girls were wonderfully challenged by the activity. It helped them consider their outward presentation and interior world, all in a hip and cool way. Not only did the activity invite the girls to see themselves in a more complex way, but it was a self-esteem booster, and a centering device. What kind of world will they create? What kind of person will they be? The CD art activity assumes each girl is a gift to the world-unique and beautiful and strong.",0,,
424,I'm going to give this shield to my baby sister when she is born so she knows I'll take care of her and wonít let anyone hurt her.,0,,
425,I protect my family because I don't want my family to be in danger.,0,,
426,"This workshop did wonders for the one 5 year old boy.  His mom was talking to him about his shield and what the pictures/words represented.  A picture of a woman statue, kneeling down, holding up the world was supposed to be her.  As he was telling her this he started to cry and so did his mom.  He saw his mom trying to carry the world on her shoulders for him and his sister.  This is coming from a boy who is outgoing, but very shy when you ask him what he is thinking or feeling.  As a leader this touched my heart.  Sometimes I get to be a part of hearing the children tell their moms about their art and sometimes I donít.  Knowing that leading the ìwindowsî really does reach these children makes my job all the more worth while.",0,,
427,I would protect my family because I love them.,0,,
428,"One boy who doesn't usually like to show his work or talk about it, got up to show his shield and talked about how he and his foster father had been designing a coat of arms before he was taken to another placement.",0,,
429,I have the love of my mom that will protect me.,0,,
430,"Having them realize that they need to & can protect themselves.  They don't just have to worry about other people.  One boy said, ""I chose myself because I protect myself from danger.""",0,,
431,"The protective shield gives you memories so if you're not with your family, you can think of them and not feel alone.",0,,
432,The moms and teens really discovered that they are stronger than they think. They also fully realized how their past has made them strong!,0,,
433,I am strong because of my brain!  I am strong because of my past!  I am strong because I am a girl!,0,,
434,We are strong because....,,,
\,,,,
"We can adjust to new situations...We can make new friends...We are funny,smart, and cool...We are brave...We love...We help people...We work hard...We are good at our video games...We have fun.",0,,,
435,I really liked this project because it gave me a chance to see what my strengths are and what I can expand upon.,0,,
436,"I am strong because...I act positively, I think of my family, I think positive, I have hope, I don't think of the past, I think of the future, I have faith.",0,,
437,"I am strong because I see other teens doing bad things and I choose not to. My mother was strong for leaving and coming to the shelter, that makes me strong too.",0,,
438,"I am strong because I am smart, I have good friends, I'm creative, I'm loved and I am a forgiver.",0,,
439,I am strong because I see that my mom is strong.  I am strong because I have lived a hard life.  I am strong because I came to the shelter.,0,,
440,"This is hard - I know I am strong, but I don't know where my strength comes from.",0,,
441,"I am strong because in spite of it all, I am still happy.",0,,
442,Can I take this home to show my mom all the good things about me?,0,,
443,All of the work was very beautiful. In fact we hung some of the work up and around the children's program. The kids also chose to take their art to their rooms to hang. I encourage this because it promotes pride in themselves and to use their art as a way of making their rooms more familiar and comfortable.,0,,
444,"Most of the children were enjoying themselves.  They were drawing ""happy pictures"" which helped them recollect ""happy memories"" of when they were home.  One boy just colored with dark colors and yet it seemed like he was at peace because he released some of his hidden emotions.",0,,
445,I am beautiful like a Maui sunset.,0,,
446,I feel happy in the shelter because I don't have to be afraid anymore.,0,,
447,"This was a great exercise in how children can be very different from one another--it helped them to appreciate one another's differences.  For example, when choosing what makes them ëshine,í some of the kids chose activities like running or playing soccer, while others chose more artistic activities like drawing or singing.  It showed that everyone has their own special gifts.",0,,
448,I really shine because the person that makes it possible is my mom. I feel good whenever I help my grandmother. Whenever I teach my brother something it makes me feel great.,0,,
449,"These are the things that make me shine: my smile, love, family, church, friends and my mother. I shine because of my mom, my education, my family, and because I feel I am strong.",0,,
450,My rays are coming out of my heart where it is warm and bright.,0,,
451,"The participant was able to begin focusing on himself rather than on his mom or dad,  and on his strengths rather than the difficulties he has been having.",0,,
452,"Hands are for loving, Hands are for creation, Hands are for playing.",0,,
453,The participants loved being able to think of all the ways they can help one another. One child said ëMy hands help others and that helps the world.í,0,,
454,We learned to respect others by using our hands in a loving way. We can be kind and show love to anyone. My dad has hurt my mom and his hands are mean and scary. He makes people and my mom cry.,0,,
455,This hand will hold me up so high to see all the bad and take it from people that hurt.,0,,
456,The most rewarding thing was to see the children be proud of the things they had done to help people in their lives.,0,,
457,"There is a nine-year-old girl at the shelter who was very verbal and expressed that people see her as weird and strange. But she also expressed that she knows she's not. She illustrated this by making the outside gray and scribbly and her inside bright and cheery. I love it when kids can overcome how and when others attempt to bring us down!  This child was always very hard on herself and on other people.  Doing this project made her very introspective. She discovered that she wasnít really like the way people saw her. She knows that she is not weird or strange.  Along with that, she discovered that other people didnít have the power to determine who she was or what she could do. SHE had the power to change all that. It was very helpful to her when dealing with the bad feelings about her father and how he had ruined all her family memories. She learned that she could create new memories and that she could be in control of the outcome.  She was able to apply these new discoveries when working on other workshops.",0,,
