id,str_quote,bln_inactive,,
2,"I love hearts, it makes me feel special, my mom will also feel special when I give my art to her.",0,,
3,This workshop allows me to understand where I am coming from.  I always look forward to coming to this class because I express myself through colors.  I love to draw art even more while I am sober.,0,,
4,"The art workshop helped the kids feel more open to say why they are here, and the sharing helped them see that they had all been through the same things.",0,,
5,I am here because it is nice and because my dad was trying to kill my mom.,0,,
6,The kids were having problems with each other outside of the group.  The art project brought out their sibling rivalry so they could find a way of calming down and focusing on themselves instead of each other.,0,,
7,"I'm going to miss doing art when we leave.  I didn't think these groups were going to help me, but they have.  I can be true to myself and open up and still be safe.",0,,
8,"The children were able to express their feelings, from sadness to anger, without being ridiculed.",0,,
9,"It was amazing to do artwork with staff, interns, volunteers, and clients together.  We did this workshop in the park as part of an agency retreat.  I feel that it really brought us all together as a community and let us open up.",0,,
10,AWBW is one of the avenues I chose so that I can make a difference in this world.  I feel fortunate that I can help.,0,,
11,I've been asking about a journal... Now I have one and I designed it myself! Great therapy!,0,,
12,The workshop helped me to paint how  I want my life with my girls to be someday:  Standing on green grass with sunshine and flowers all around.  It was spiritual and it helped me focus on why we are here: to learn to live a peaceful life.  I enjoyed the workshop.,0,,
13,"Even in the workshops when I don't feel like I connect as much with my artwork, I am still gaining so much from the very act of coming together and forming a supportive and healing space.  Listening to, sharing with and just being with this group of women gives me the inner strength that I need to keep going each day.",,,
\,,,,
I feel a part of something. I feel like my feelings are okay. I feel stronger when I am here.,0,,,
14,This workshop was awesome and it helped me to realize that I am worthy of love and happiness.  I am complete and perfect already!,0,,
15,The workshop is neat due to the fact that I get inspired and in turn I can inspire someone else ó that is empowering.,0,,
16,I believe this program helped me become more positive in my outlook on life and on myself.,0,,
17,A chance for creative expression through poetry and art is wonderful.,0,,
18,I chose the wave because I can be as calm as a wave... and the thunder and lightning because I can be as angry as thunder.,0,,
19,"I learned to be respectful not rude, and learned to share.",0,,
20,I love this group.  It always gets me to share a lot of my inner feelings that I keep mostly inside.,0,,
21,My angel is going to look mean so it can protect me.,0,,
22,"Mommy, look: I made an Angel to watch over us.",0,,
23,My dad explodes like a volcano and the fire comes out hitting.,0,,
24,It makes me want to stomp.  I get all the mad out of myself.  ó Four-year-old girl.,0,,
25,It was rewarding to see the children explore and understand the importance of handling anger before it gets to the point of explosion.,0,,
26,"Thank you, I now feel stronger about myself and my children.",0,,
27,I think this project was the best because I never felt so relaxed and it made me feel really good about myself.,0,,
28,Thank you for this beautiful time.  It helped me a lot. God bless you.,0,,
29,"Muchas gracias, me gusto como poder escribir y expresar mis sentimientos, gracias por que no sabia.",,,
\,,,,
,,,,
\,,,,
"Thank you very much, I liked how writing expresses my feelings, thanks, because I did not know.",0,,,
30,"The children were hesitant at first, but derived great satisfaction when their pictures started coming together.",0,,
31,These workshops reach the depth of people's souls in such a short amount of time. They're amazingly powerful.,0,,
32,"Reminds them where they were, and where they are going.",0,,
33,The workshop helps relax me and helps me reinvent myself.  I leave here feeling strong and refreshed.,0,,
34,Yo recomiendo este taller no solo para nosotras que estamos en el programa sino para todas aquellas personas que sienten que no hay ayuda en ningun lugar.,,,
\,,,,
,,,,
\,,,,
"I recommend this workshop not only for us in this program, but for all the other people who feel there is no help anywhere.",0,,,
35,"A three-year-old was thrilled with her paper self.  She danced around the yard with her mirror image yelling, ""Look at me!  Look at us!""",0,,
36,Me senti muy feliz al estar trabajando en equipo y me senti mas relajada al poder sacar toda la amargura de mi alma y poder salir adelante.,,,
\,,,,
,,,,
\,,,,
I felt happy working as a group.  I feel more relaxed and able to take out all the sourness of my soul and continue forward.,0,,,
37,"El taller me ha hecho sentirme que puedo hacer cuanto you quiera en al vida, la felicidad esta en mis manos.",,,
\,,,,
,,,,
\,,,,
This workshop made me feel that I can do whatever I want in life: happiness is in my hands.,0,,,
38,"Me ayudo a poder realizar un concepto de lo que soy de lo que quiero y de lo que tuve, y lo que sere.",,,
\,,,,
,,,,
\,,,,
"This helped to realize a concept of who I am, what I want, what I had and what I will become.",0,,,
39,I always think that I'm not very creative but these art projects somehow bring out a lot of creativity in me.,0,,
40,A mi me ayudo a pensar que si quiere uno todo lo puede lograr solo es que tenga ganas de salir de la violencia y al salir puede uno respirar ese olor tan bonito como el el del mar y respirar el amor y el carino de mi familia que ahora se que ellos pase lo que pase siempre estaran conmigo.,,,
\,,,,
,,,,
\,,,,
"It helped me to think that if I want it, I can make anything happen and do what it takes for me to get out of the violence.  I can breathe the fresh ocean air, and breathe in the love of my family since now I know that no matter what happens, they will be there for me.",0,,,
41,"Me ayudo a sentirme que puedo tener mas ideas metas, y a expresarlas, que tomando tiempo para uno mismo y pensar en uno nos dara el valor para asimilar todo lo bueno y a seguir adelante con nuestra meta fijada.",,,
\,,,,
,,,,
\,,,,
"It helped me to feel that I can have ideas and goals, and express them; that I can take time for me, and think about myself.  It gives me courage to assimilate the good and move forward with my goals.",0,,,
42,I liked this workshop because it let me show kids things that I was too embarrassed to tell them.,0,,
43,So you mean I'm not the only one that goes through this?,0,,
44,It is rewarding to watch the children create!  They made their dolls and even gave some of them families.,0,,
45,I'm very very excited about this class.  It brings me so much peace spiritually.,0,,
46,It helped me really acknowledge that I do have goals and dreams and now I can work towards them.,0,,
47,This is a lot of fun to do!  Make a map of me! ó,0,,
48,"This map shows me that I'm full of sadness, hate and love.",0,,
49,"They discussed how relaxed they felt during the workshop. A week after the workshop, a client told me that she was really stressed and the night before she had written in her journal.  She said she felt so relaxed and it gave her a new perspective on her problems by getting them out on paper.",0,,
50,"This helped me to learn how I felt and to express my feelings freely without being afraid of anybody's reaction, as opposed to being afraid... like before.  It was hard, but good for me.",0,,
51,I enjoyed the relaxation techniques a lot and also like visiting my safe placeù ...  how calm and peaceful it is.,0,,
52,This class brings more feelings each time.  It feels good to learn about my feelings and identify them. Just to feel is a blessing.,0,,
53,This workshop was so useful to me ó it brought out feelings I haven't felt in two years.  I am progressing in my life and my feelings.,0,,
54,My safe place is inside of me and I can open the door or close it.,0,,
55,My safe place was at my Grandma and Grandpa's house.  No one would hurt me there.,0,,
56,A four-year-old girl got a huge smile on her face while visualizing her safe place.,0,,
57,My safe place is in the library.  I feel that when I am in the library I can feel the peace and it is quiet.,0,,
58,It's amazing how a simple project that only involves paper and markers can become such an emotional outlet to the children.  I love this workshop.,0,,
59,I really liked today's workshop because it made me feel better about myself and it helps me to forget all the bad things that happened to me.,0,,
60,I've been here five months and Windows has been a big part of loving me! Thank you.,0,,
61,"This class makes me feel so special, thanks.",0,,
62,"The CD art activity was such a success! The girls were wonderfully challenged by the activity. It helped them consider their outward presentation and interior world, all in a hip and cool way. Not only did the activity invite the girls to see themselves in a more complex way, but it was a self-esteem booster, and a centering device. What kind of world will they create? What kind of person will they be? The CD art activity assumes each girl is a gift to the world-unique and beautiful and strong.",0,,
63,"I lead Windows workshops with pregnant teens. They call me ""The Art Lady!"" and are excited when I arrive at the Center.  ",,,
\,,,,
,,,,
\,,,,
"Doing the Debut CD project, I asked the girls to create a CD that would express the message that they want to tell their child.  After the project, one of the teen moms who had been very dependent on her boyfriend said, òNever have a baby because you are lonely.""  This was a major moment of self-awareness for her.",,,,
\,,,,
,,,,
\,,,,
"It made me smile recently when one new girl told me she had heard about the Windows groups and she was looking forward to it because it would give her a break from having ""to talk about feelingsì but little did she know, they talk about feelings all the time through their art!",0,,,
64,The most effective part of the workshop was feeling that the children had succeeded in making all their dreams come true.  It was rewarding to see that all the children had so many dreams and how they really wanted them.,0,,
65,All the children shared their work with the whole group at the end.  They were very pleased to show off.,0,,
66,My mom will be surprised to see how I made my project.  I can tell her about how dream catchers work.,0,,
67,It was rewarding when the younger kids expressed some of their nightmares to the group which I thought was great because it meant they trusted everyone.,0,,
68,The workshop opened an avenue of talkù for several children ... fears and dreams about home life.,0,,
69,"Everyone shared a bad dream during the opening circle.  They shared a nightmare they had experienced during their first days at the shelter.  The next day, after making their dream catchers, the children expressed feeling a lot better at night in their beds.",0,,
70,This project was very fun. I want to add more things to my holder and plan to keep it as a reminder of what I am going through right now.  And to encourage me to be strong and continue.,0,,
71,Sharing my feelings with others shows me that I'm not the only one.  It keeps me more focused on getting my life together and assures me that there is light at the end of the tunnel.,0,,
72,The most relaxing and beautiful way to get in touch with weaknesses and strengths.  I loved it.,0,,
73,"A young woman made a little purse for her four-year-old daughter when she was finished with her pillow.  Inside she wrote her dreams for her daughter to grow up respecting herself:  having a unified family if she chooses, doing what she wants, getting an education and being independent before anything.  She had tears in her eyes as she was saying this, as she didn't have these things herself.",0,,
74,Me gusto mucho tener un momento de arte creo que si nos ayuda mucho a dejar de pensar en cosas que nos hacen dano.  Gracias por tener artes como este.,,,
\,,,,
,,,,
\,,,,
I like having a moment of art. I believe it will help us to stop thinking of things that hurt us.  Thanks for having art like this.,0,,,
75,"Once I started, I couldn't put it down.",0,,
76,"The children I worked with were all males.  What inspired this workshop, besides it being one of my favorites, is that one child shared his fear of the dark and is scared because of the violence he has seen between his mother and father.  He sometimes has had bad dreams about the things he's seen his father do to his mom.  His brother, who is older, became very tearful when he spoke about his mom and the abuse. Both boys witnessed their father choking their mom.  This child was afraid his mom was going to die if they stayed.  ",,,
\,,,,
,,,,
\,,,,
"I told them about this workshop and the youngest (9-year-old) was thrilled, he stated he wanted to put a prayer in his pillow because he believes in God and he wants something close to him at night.",0,,,
77,I feel happy today - good to be in a place that's safe.,0,,
78,"In leading this workshop, it was very rewarding to witness the children actually realizing that the most important gifts are those they don't need to buy.",0,,
79,"The children really enjoyed themselves with this project, and found a way to let out anger wherever they go.",0,,
80,I had a lot of stuff and it felt good to let it go and get rid of it.,0,,
81,"It's a great group project to start off with, the children get to express without being scared to share.",0,,
82,It is very rewarding to give the children the opportunity to experience the magic and beauty of seeing something invisible become visible.,0,,
83,I like creating expression masks because it's like therapy.,0,,
84,I want my face to be dark and scary so nothing can get me.,0,,
85,"I was feeling left out with nothing to do, but now with this smile [pointing to his art] I can leave this room and have a smile on my face.",0,,
86,"My face was an aggressive face.  After making it, I did not feel like that anymore. ó 13-year-old boy.",0,,
87,"Teacher, I feel better than when I first came in!",0,,
88,The workshop gave children self-confidence and an escape for their feelings.,0,,
89,I had fun making this shaker and can't wait to show my mom.  I can shake my bad feelings away.,0,,
90,That's so cool how you can cover up your mistakes with the paint.,0,,
91,Look!  I made a fish.  I never knew how to make a fish before!,0,,
92,Working with the crayons and paint in this workshop facilitates the children being able to make mistakes and begin again.  That's important when dealing with children who may not have strong self-esteem.,0,,
93,One of the children in our group truly became empowered via this workshop.  He was able to really appreciate what he had created with no harsh judgment of  himself.,0,,
94,I like to do art because every way is right!,0,,
95,"People die like flowers, but we can make more friends, huh?",0,,
96,"This was great freedom. It didn't matter which way or what the children made. There was lots of laughing and 'Hey, look at mine!'",0,,
97,I'm making mine into a choker.,0,,
98,I am so happy.  I don't want to leave the room.,0,,
99,I love this workshop so very much.  I always feel better about myself in some way.  It is wonderful and I feel so blessed and happy.,0,,
100,I always feel a sense of peace and calmness in Windows group.  This workshop brought out a gratitude for life.,0,,
101,"I didn't think I would like it, but I really, really enjoyed it.",0,,
102,It helped me to work something out in writing that I couldn't in my head.,0,,
103,"I love this class so much.  I look forward to this class all week, anticipating what we will be doing next.  I always leave this class feeling happy in my own skin.  It builds my self-esteem.",0,,
104,It was good for me because it let my mind go places it had never been before; it was positive.,0,,
105,I want to thank our teacher for doing such a good job at bringing out my fears through this class and making me feel positive about life.,0,,
106,It brings me out of myself and gives me a brighter future.  I feel it helps out  moving forward in life to the positive things life has to offer.  I am very grateful for this group and hope it continues in days to come.,0,,
107,The art class helps you realize a lot that you didn't or couldn't realize before.,0,,
108,I like drawing my hands and my feelings.,0,,
109,"This workshop is a reminder of how bad my life with him was, and drawing my hand gives me hope to go on and try my best to succeed for my children and me.",0,,
110,"AWBW workshops always let me know what I need to be working on... I've probably led this group over 6 times and I usually have handprints that represent the union between my husband and I... but today I worked on some childhood issues!  I've done about 3 workshops in the last 2 weeks and each time it ended up being about childhood!  I obviously needed to let more stuff out.  I did one hand representing the molester and one hand representing me now. And wow it felt good!  The contrast between the two hands was so powerful.  Thank you AWBW for allowing me as a leader to grow, heal and recover even while leading workshops.  Yahoo!  My handù was surrounded by a golden light and inside was a heart representing my love for me.  Surrounded by squiggly lines that seemed to me to be like my DNA changing, releasing all the old memories, changing, becoming new undamaged DNA.  Well ,anyway, it was way too cool for me! And the rest was a peaceful blue - one being peaceful with myself.",0,,
111,It allowed me to release rage toward his hands.,0,,
112,This is the path between two walls.  This is my mom's hand reaching from one wall to my hand on the other wall.,0,,
113,Thank you so much for such a great chance to express ourselves with our hands and mind.,0,,
114,This workshop made me focus on the positive forces in my life that have helped me hang on when I had a hard time fighting for my life.,0,,
115,Happy jars make us happy and the girls like doing this project.  I always hear a special request.,0,,
116,This helped me see that I have a lot in myself to share with others.,0,,
117,The most important thing in my heart is my mom. ó 11-year-old.,0,,
118,"Although I didn't share my art with the class, it brought me inner peace.",0,,
119,My heart is this big (holds hands outstretched) and my heart is free! ó 6-year-old participant.,0,,
120,"I miss my dad, this is him!",0,,
121,I love hearts. It makes me feel special and my mom will also feel special when I give my art to her.,0,,
122,"I feel as though my heart has been punched over and over and there is hardly anything left to hold it together, hardly anything to keep my hope from running out, hardly anything left to stop the emptiness and loss that I feel.  But if you look at this side, there are only a few holes and all the strings end there.  It's as if I know that all the painful experiences I've had are going to heal.  What I have gone through will make my heart stronger.  I will always remember, but I will be different.  I will not have an empty heart.",0,,
123,This heart is so mixed up it doesn't even know it's a heart anymore.,0,,
124,"Helping my mom brings me closer to her and I feel if she needs some help sometimes, I know I do too.",0,,
125,The relaxation took me to a place that I had not visited in a long time.,0,,
126,This class helped me to relax (I'm learning) a little more. It allowed me to let the good memories flow and reminded me that Recovery is an Inside Job (starting with me).  I just feel better in this workshop.,0,,
127,"I don't care for art, however I am appreciative of Windows Workshop! I have no doubt that over a brief period of time I'll be a strong supporter of this work.  It helps me be open my closed will.",0,,
128,"This particular class helped me to understand that I am not a victim anymore, but I am a survivor.",0,,
129,The most rewarding thing was to see the children be proud of the things they had done to help people in their lives.,0,,
130,I love these workshops! I leave feeling happier and more positive about whatever lies outside the doors.  I've realized I can actually express myself better with art.  Thank you!,0,,
131,I think that this program is really helpful to my mom. It helps her relax and feel good.  She always shows us what she has created here at this program.  This program is great. ó Teen child speaking about mom.,0,,
132,This workshop was very helpful in accepting who I amù and not feeling ashamed.,0,,
133,"This group is powerful, allowing us to share our innermost selves in a safe place.  Thank you.",0,,
134,Esto es magnifico taller porque nos ensena a luchar y que somos unas mujeres  muy valiosas en nuestra sociedad.,,,
\,,,,
,,,,
\,,,,
"This is a magnificent workshop, because it teaches us that we are valuable women in our society.",0,,,
135,I enjoyed this time because I'm better with pen and paper than with my voice.,0,,
136,Thank you for allowing me to remember who I am.,0,,
137,It has helped me open up and realize I'm worthwhile.  I found out I'm not alone.,0,,
138,"Excellent - at first I thought that the ethnic mixing wouldn't work but these ladies moved me with their strength, coming from different cultures.",0,,
139,Great to reflect on positive aspects of myself and illustrate them.,0,,
140,I feel the workshop has helped me significantly with a lot of my self-esteem issues.  It has also helped me to feel comfortable in my own skin.,0,,
141,I am loving myself so much more.  I am accepting.  I am accepted.  I am at home.,0,,
142,I have to show my mom all the things I've made so far.  I want to hang some things on the wall to look at.,0,,
143,"People see me smiling, but inside I am not smiling.",0,,
144,This workshop brought out emotions in one child that I had no idea were going on.  It was great!,0,,
145,We should do this one again when I feel mad.,0,,
146,I feel so much relief now that I have made room for happiness.,0,,
147,"Doing the Life Clock workshop, I could see my time was running out.  I would have been killed and my life clock would have stopped if I had stayed with him.",0,,
148,"It's time to wake up! My heart is in the middle but it's trying to have clear thoughts. Time to remember dreams, look at the truth, to have quiet times, to play, to leap and to soar.",0,,
149,"Reminds me how my grandmother's clock used to irritate me. Where it was sitting it always used to get in my way and it seemed like I was always accidentally knocking it off the wall. (She laughs). So now when I think of that clock I am reminded that I am free from bondage, free to look at my anger and to ask myself why was I selling my soul? Here the pendulum is in motion again, just like my life is in motion again.",0,,
150,I'm not a very creative person.  But this allowed me to do something with art I can be proud of.  It really helped me!,0,,
151,"It's hard to remember my past without feeling sad but all this pictures cutouts and colors brighten up my future.  Even though my past is gray, black and blue.",0,,
152,"I'm really looking forward to a happier me, healthy with much spirit.  Laughing out loud!",0,,
153,This workshop reminded me that I am complete all on my own and don't need anyone else to make me whole.,0,,
154,"I'm putting my daddy on this bag, because he needs some magic right now.",0,,
155,I used to draw myself sad but since I live in the shelter I see myself happier.,0,,
156,This doesn't look like me but maybe later I'll be this happy.,0,,
157,I want my world full of peace and good people.,0,,
158,Hoy me permitiste expresar que en realidad tengo mucho por dar y por sacar.  me encuentro mas tranquila que cuando llegue a este lugar; realmente me da gusto que cada dia este recuperando mi vida y mis suenos.                              ,,,
\,,,,
0,,,,
\,,,,
,,,,
\,,,,
[Today you allowed me to express that in reality I have a lot to give and take out.  I find myself more tranquil than when I came into this place.  In reality I am happy that every day I recoup my life and my dreams.],0,,,
159,I like making Mistake Turkeys.  Now I feel like I have very few mistakes of my own.,0,,
160,I think all of the children enjoyed the challenge of fitting the pieces together and got the correlation between that and putting their lives back together.,0,,
161,"The colors and shapes are so different, put them together and we can make a picture.  It's like the colors can be our feelings and the shapes are what we do, our actions.",0,,
162,My life must be organized with love and support.,0,,
163,"This workshop was just really awesome. These kids really love their moms. One said, ""My mom is so special, she deserves everything I make.""",0,,
164,"The children cheered when we said, òToday we will be using paint.""",0,,
165,Will I be able to fly when I leave the shelter?,0,,
166,"A lot of the children didn't believe they were capable of making a butterfly, and it really built up their self-esteem.",0,,
167,I liked to make the flowers.  I liked to make the garden as my family.,0,,
168,"This was a challenging workshop, but I really enjoyed it. Thanks.",0,,
169,It was so rewarding to see the children's faces when the music boxes were complete. The sounds were amazing.,0,,
