id,str_quote,bln_inactive,,
But it allowed each individual to explore positive aspects of themselves. ,,,,
\,,,,
,,,,
\,,,,
" ""I didn't realize I was good at all this stuff."" (age 8)",0,,,
994,This is a very beautiful the flower that I made. I hope to be everything that I wrote in my flower. I am very happy that there are groups like these that help women.,0,,
995,"ëAngelaí is a five year-old girl who entered our Outreach program after her mother left her abusive husband.  Angela had constantly seen verbal arguments in the home, and had heard her father threaten her mother on multiple occasions.  As her mother was preparing to leave the home, Angelaís father punched her mother in the face, and then went to his car and got a gun, which he waved around in front of the family.   ",,,
\,,,,
0,,,,
\,,,,
"Since then, Angela has had difficulty coping with the trauma, and had begun to cut her arms in an attempt to alleviate her pain.  She had also told her mother that she wished she was dead.  Angela also appeared to suffer from such debilitating anxiety, that she was afraid to have her mother leave the room during counseling sessions, and needed to have the door open at all times.  Along with helping the family seek therapeutic services, I worked with Angela to help her build coping skills.  The best way to help Angela turned out to be via art as she is too young and too deeply traumatized to be able to verbalize her fears.  ",,,,
\,,,,
0,,,,
\,,,,
"During a recent session, I decided to use the Aggressive Crayon warm up, as Angela had difficulty understanding what to do when she was angry, and tended to turn it into anxiety.  At first she was reluctant to show anger, even on a piece of paper.  As I showed her how I could ëbe angry,í she began to dig her crayons into the paper and scribble furiously.  As we both pressed down on our papers as hard as we could, her face began to relax; we kept going until she was out of breath, and we were both laughing.  Not only was this warm up a clear way for Angela to understand ëanger,í it was also a safe place for her to leave it, freeing her to experiencing a release.",,,,
\,,,,
,,,,
\,,,,
"In the days and weeks after the warm-up Angela has shown improvement.  She lets me shut the door now during sessions, and her hyper vigilance appears to have decreased.  While still anxious, Angela is able to manage her fears better and engage with other children and she is now in therapy at a local mental health agency.  ",,,,
\,,,,
0,,,,
\,,,,
"As her mother has also been getting support at Emerge, and we have been talking to her about how to help her children get through this, mom has reported that Angela has not cut in a while.  Part of this, I believe, is due to Angela not seeing her mother crying as much at home, and Angela feeling like she is living in a safe place.  ",,,,
\,,,,
0,,,,
\,,,,
"Obviously, the road for her will be a long one, but there has certainly been improvement, and the art has been extremely helpful to her.  Angela has been coming less frequently in the last several weeks, but I see this as a good sign as previously she had been asking for me constantly, which worried me.  I didnít want Angela to feel like Iím the only safe adult in their life, but have an entire network instead.  ",,,,
\,,,,
0,,,,
\,,,,
"The progress, however, is occurring, in even more profound ways than we are able to see but her symptoms have clearly decreased, and I think that she will pull through!",0,,,
996,"I love to participate in the art activities with the children.  While I intend to simply create an example, the art always finds a way of digging into my psyche, so that I can finish and see EXACTLY where I am mentally on any given day.  Itís also a great way for me to be able to cleanse myself of my own emotions so that I can be fully present for the children I work with.  Thank you so much for all you do.  AWBW provides a unique and invaluable tool for healing!",0,,
997,I always keep my anger in and it eats me.,0,,
998,"The kids shared openly about their struggles in managing their anger. Some of the kids clearly had never talked about some of their feelings, this was a healing experience for them.",0,,
999,"This workshop came about after I had been working with Ana on her anger issues for several months.  She continued to have trouble working with her temper that was easily triggered.  She has suffered direct abuse from her father, along with witnessing some very traumatic incidents in the home.  She has become verbally abusive to her sisters and mother, and has begun hitting walls.  Breathing, time outs, and journaling have been slightly effective, but we'd been running low on tools that allow her to express anger in a safe way.  At first Ana was unsure about the exercise and thought it was silly.  But the harder she scribbled, the more she enjoyed herself.  She at times broke the crayons, and looked at me as if she'd done something horribly wrong.  I assured her it was fine and even broke one myself.  The act of this seemed to liberate her to really dig in with the crayons.  At the end of the workshop, she commented, ëI think this will work.  I'm actually going to try this at home this week!",0,,
1000,"ëAngelaí is a five year-old girl who witnessed verbal abuse in the home ending with her father threatening her mother with a gun. To cope, she began cutting her arms and told her mother that she wished she were dead. I used the Aggressive Crayon warm up. As I showed her how I could ëbe angry,í she began to dig her crayons into the paper and scribble furiously. Her face began to relax; we kept going until she was out of breath, and we were both laughing. The art has become a way for Angela to understand ëanger,í and a safe place for her to leave it, and experience a release. Since this workshop, Angela has shown improvement and has stopped cutting.",0,,
1001,"Iíve worked with Ana on her anger issues for several months. She suffered abuse from her father and traumatic incidents in the home. She would hit the walls and became verbally abusive to her sisters and mother. Breathing, time outs, and journaling were slightly effective, but we'd been running low on tools that allow her to express anger in a safe way. I tried the Aggressive Crayon warm-up. At first Ana was unsure and thought it was silly, but the harder she scribbled, the more she released. She broke the crayons and looked at me as if she'd done something horribly wrong. I assured her it was fine. This seemed to liberate her. At the end of the workshop, she commented, ëI think this will work.í",0,,
1002,"This workshop enabled her to vent, it was great to see her find a way to handle her anger in a positive manner. It gave her a safe place to get things off her chest.",0,,
1003,The most rewarding was seeing on how the children got to take out their anger in a positive way. All the children were really creative and focus on the activity. They got to express their anger in coloring and using the crayon pass with different colors or just a single color.,,,
\,,,,
,,,,
\,,,,
Red represents the color of anger to me. (age 8),,,,
\,,,,
,,,,
\,,,,
Red is the fire I have inside me and gray represents the fog and I cannot see the people I hurt. (age 10),0,,,
1004,"The children worked together and gave each other ideas and examples of what friendship is, and what the characteristics of a friend are.",0,,
1005,My friend is strong and looks like the Hulk because he protects me.,0,,
1006,"A friend sticks up for you, like I stick up for my little brother (age 7) ",,,
\,,,,
"A friend shares, like I shared my coat when my friend was cold (age 6)",,,,
\,,,,
A friend is honest and reliable (age 17),0,,,
1007,"When a group of the children were talking together, Grace, age 6, asked another child if she could tell her where her dad was. Before releasing this information to her peer, she made sure to tell her older brother (who was also in the room) to plug his ears. She then disclosed that her dad was in jail and remarked, ëWhen my friends at school ask me where my dad is, I tell them that he is at a sleep-over.í",0,,
1008,"Today I made a promise to myself not to be afraid, and to begin my life journey of loving myself.",0,,
1009,I wish that everyday was like today. I just donít want to be scared.,0,,
1010,I loved doing this workshop. My mandala represents my strength of being a woman of courage. I am free.,0,,
1011,Me ocupo tanto con la vida que se me olvida mantenerme positiva sobre las cosas que verdaderamente quiero. Para mi esto va a ser un recuerdo diario de decirme a mi misma que me quiero.,,,
\,,,,
,,,,
\,,,,
I get so caught up with life that I forget to remind myself to stay positive about the things I really want. This is a daily reminder to tell myself just that I love myself.,0,,,
1012,"The part of the poem read what impacted me most was the part about 'nothing I do provokes the violence. Nothing about me causes the violence.' That part made me realize it had nothing to do with me. I always try to rationalize it or find reasons for why things happen to me. When you're aware of the reality stop blaming yourself, you can heal, and even more, make sure no one does it to you again.",0,,
1013,"The workshop was easy to understand and create, yet participants felt like they gained a lot from it. This was a good workshop to use with a first-time participant.",,,
\,,,,
,,,,
\,,,,
It felt really good to take some time for myself. I feel relaxed. I was looking forward to this all week! - A first time participant.,0,,,
1014,"It's always good to start my day with positive thoughts, I am going to keep this charm hanging on my mirror so it's the first thing I see in the morning.",0,,
1015,The workshop helped me to look at my strength and what I have now. I obtained more courage and faith of what I am doing.,0,,
1016,"I really enjoyed this group. I was feeling very sad when I came, and now I feel at peace.",0,,
1018,I feel more relaxed and complete as a person after creating a better life for me.,0,,
1019,I really liked this workshop because it helped me see that there was always someone by my side even when I felt the most lonely.,0,,
1020,Building up my self-esteem and self-worth through art gives me the confidence and courage to do the right thing every day.,0,,
1021,"I enjoyed this a lot, it helped me to feel better about myself.",0,,
1022,I enjoyed it because it made me really see how thankful I am for the steps I have made.,0,,
1023,One client stated she has learned to love herself and appreciate everything she does.,0,,
1024,"A participant started to cry when she shared her card, stating, ""I have never been thanked in my life! All that ever came out of his mouth was blaming, humilliations, and obscene words. In this workshop I realized I don't have to wait for anyone to thank me. I have to value and love myself and thank myself for how brave and good I have been.""",0,,
1025,"My card is something beautiful I made for myself, I haven't made anything just for me in a long time.",0,,
1026, I now know that I CAN even if others tell me that I can't,0,,
1027,"Itís rewarding to give the women an opportunity to know who they are, and see what they are really grateful for in life.  Also, to teach them that we must give thanks every day for what we have, from the smallest to the biggest things, for life itself, for our family, our children, nature, etc.",0,,
1028,"Loved this workshop! Sometimes I take things for granted and donít take the time to look at where I am and what I have. It's not about the material things, it's about what is really meaningful in life.",0,,
1029,"We recently did the Red Flag Banner group. This was such a successful group because all of the women finally opened up about their past experiences living with their abusers. Every single one of the women was reflective of their past. I, as a leader, enjoyed conducting the group as well.",0,,
1030,Now I know what the red flags look like...literally. This class has helped me find the courage to trust my instincts.,0,,
1031,"The workshop allowed me to relax and express my thoughts and feelings, and also to learn more about myself.",0,,
1032,"You don't realize some of the things that you've been through until you step back and look at the whole situation.  But everything will be all right. You can be happy again, smile and laugh and be yourself.",0,,
1033,"Today's workshop helped me do soul searching, and guided me to understand how to express myself without feeling guilty.",0,,
1034,"It was rewarding to see that the children use the project in so many different ways.  Some looked at it literally, painting their bones and veins, and others made a collage.  I liked that they felt no judgment to have their work be ""a certain way.""",0,,
1035,It can be really hard to be honest about what you look like on the inside. It's easy to hide bad things from people but sometimes it builds up and you just feel like you will explode.,0,,
1036,"I like doing this because I can be creative. When I get mad, I can just draw anything and use my marker really hard to let it out!",0,,
1037,Itís rewarding seeing the kids be so open and creative in their portraits; its really helped them become more comfortable with themselves.,0,,
1038,Inner-Self Portraits is definitely my favorite workshop to do with our participants. The children really connect with the activity and find themselves wanting to add to their portraits later. It's great to see a workshop that creates such an impact on our families. The children really take time to reflect on themselves as a person and find the good and bad within.,0,,
1039,I saw a beautiful heart that shines in me.,0,,
1041,This was helpful for me to see myself and understand my inner beauty.,0,,
1042,The participants stated that they can now be themselves. Before they were who the perpetrator wanted them to be. They are now beautiful without the scars and bruises.,0,,
1043,This workshop allowed me to see that I am in control of who I am internally and I will not allow horrible incidents to have power over me and change my inner-self forever. This workshop also gave me the confidence and ability to speak about the abuse I experienced without feeling shame.,0,,
1044,"You hear people talk about inner child stuff all the time, but when you can put something on paper that makes a picture of what's really inside, really how you feel, it feels like it makes more sense.",0,,
1045,I just want to keep moving closer to myself.,0,,
1046,I know that I can decide how I want to live my life and what I want to think about.,0,,
1047,I realize today that my interior is beautiful and full of positive things and many different beautiful colors and full of hopes and goals and I know with time my life will be better.,0,,
1048,This workshop has allowed me to see that I have some things inside of me that I keep hidden from the world and those close to me. It also helped me to visualize that I have needs I tend to push to the side.,0,,
1049,"It is so good to see that even though we are so different, we can come together here and support each other.",0,,
1050,"I can now see the pattern of the cycle, so in the future I will know what to look for. It made me realize my husband was and always will be abusive to me so I won't go back.",0,,
1051,I loved making my no-violence home.  It was meaningful and healing.  I'm giving it to my son as a promise that I'll never allow anyone to hurt him again.,0,,
1052,"This is my first time doing anything like this, it really helps me free my feelings.",0,,
1053,I truly enjoyed being around those that can relate to my past domestic violence issues.,0,,
1054,I am breaking the cycle by taking action to protect myself even if I am scared.,0,,
1055,It's so relaxing and it's great to see that I am able to feel like myself again. I'm making good decisions.,0,,
1056,"This workshop helped me feel proud of how far I've come, and excited about where I am headed.",0,,
1057,The workshop was a positive outlet. It enlightened me to share with others women who are going through something like myself.,0,,
1058,People tell me that I am special and I believe it.,0,,
1059,I like to hear my mom say I love you.,0,,
1060,I realized that I do not have to go to another country to feel like I have traveled. I can discover a whole new place by allowing myself to dream.,0,,
1061,I came in feeling sad. I feel like a weight was lifted from me.,0,,
1062,I liked this activity because it was the first time I actually looked realistically into the future and felt good about it.,0,,
1063,I learned things from every girl in the workshop. I feel good that everybody knows what itís like; that Iím not the only one. I was taught a lot by the other people. I like to come here. It makes me feel secure. This is a place where I can feel calm and collected.,0,,
1064,I used to feel dumb doing art because I never felt that I had any talent. I was also never allowed to deal with my feelings. These workshops have shown me that I DO have talent and I look forward to incorporating art into my everyday life. It is VERY healing and helps me to relax & center myself.,0,,
1065,The workshop has allowed me to connect with feelings I have bottled up and refused to acknowledge. I have started to deal with these feelings and will take steps to make better decisions and wiser choices.,0,,
1066,"I loved this project! every time I start to feel like giving up, I am going to read my postcard to keep me inspired. Thank you ladies, You really made a difference in my life in just an hour.",0,,
1067,"Last year was full of darkness and tears. Now, my life is bright and the relationships in my life are being restored.",0,,
1068,"I love doing these art workshops. They allow me to let go of all the negative things in me. They help me think about what I am feeling. Sometimes I donít even know that I am still so angry at my abuser, but when I am doing art I can let it go. I can focus on my son and my dreams. I can put my past behind me.",0,,
1069,"The workshop Turning Over a New Leaf  seemed fitting for the women in our shelter. They were working to do just that, let go of their past, redesign their lives and redefine who they are. Some of the comments by the participants during closing circle included: ëI don't know what I see in my future, but all I can have is hope.í ëI've been broken for a lot of years, both physically and emotionally, and now it is time to fix me. I am happy now!í",0,,
1070,"While doing the art project Turning Over a New Leaf, an 8-year-old boy had a creative breakthrough. As a result of the project, his feelings were no longer a secret. I noticed a shift in his behavior. Over time, he started to become more comfortable in his own skin. There are no more outbursts and heís much calmer. Heís eager to do art and is happy.",0,,
1071,"One young man has attended many Windows workshops and in the beginning he was so full of anxiety, fear, and stress.  While he talked constantly, he rarely said anything. Overtime he has become more comfortable being himself, sitting quietly, waiting patiently and expressing himself creatively. His emotional intelligence is now operating at a very high level, ranking right up there with his mental brilliance, whereas before Window's he was emotionally trapped by pain and fear.",0,,
1072,This workshop makes me feel that I can make changes and resolutions anytime.,0,,
1073,"I like to create things that help me think of a better future with dreams that can become real, and to realize there is hope for higher opportunities in life. it helped me learn ways to let go of my past.",0,,
1074,Today's workshop helped me learn how to give my life a positive turn and how to keep greeting each day with a smile.,0,,
1075,Today's workshop helped me realize that it is never late to to start a new life and give our self an opportunity to reach our goals.,0,,
1076,"Now I am learning how to express myself through Windows.   I like this a lot because part of my experience with domestic violence included not being allowed to express my feelings.  There was also a lot of negativity.  Now, Iím learning to be more positive.",0,,
1077,I will hang this up in my window where ever I live. It means so much to me. ,,,
\,,,,
I can't wait to explain this project to my mom. I know she is going to cry.,0,,,
1078,"I think it was something that I never experienced, and it was something beautiful.  I would be very happy to come another time.",0,,
1079,This is a starting point for me in learning to be more powerful.,0,,
1080,"It was really fun. I enjoyed actually having to think about how I felt inside, and let my feelings come out through the monster in me.",0,,
1081,"We have a very angry group of boys at the shelter right now, and we did the Monster in Me project.  They got so into it!  They created whole characters with superpowers and all kinds of special abilities.  It helped them deal with their anger and get it out without hitting one another.",0,,
1082,I think my monster needs to be happy. He needs to be encouraged by this mother and cheered to not be shy. I really liked doing this.,0,,
1083,I would like to do this with my mom because she can draw my dad - he is the monster in the house.,0,,
1084,"I used different colors because I feel all mixed up.  There is a box inside that the monster lives in.  Its dark and no bright colors can come inside.  Outside the box is happiness. I keep the lid on the box where the monster lives, I have to control these feelings.",0,,
1085,My monster destroys people's feelings.,0,,
1086,My monster makes sure that nobody touches me.  He protects me and keeps me safe from people.,0,,
1087,A 12-year-old boy shared with us that the monster would come out in him when he used to bully children at school. When he did this workshop he started to cry and acknowledge that he did not want the monster to come out anymore. He wants to learn to help others and not hurt others.,0,,
1088,At times I feel angry but I stop to remember what I have learned at the shelter and I want to use other ways to stop my anger.  I do not want to hurt anyone.,0,,
1089,I want a safe life.  I don't want to feel that monster inside of me.  It scares me.,0,,
1090,I have learned about the cycle of violence.  I do not want the monster to live inside of me.  I am going to do everything possible to destroy those feelings.,0,,
1091,"This was the coolest thing I ever did, and it made me happy and sad at the same time.",0,,
1092,"The majority of the children I work with have difficulty getting in touch with their feelings, and see anger as 'bad', or something they are perhaps not allowed to feel. What I loved about this workshop was that it gave children like permission to show anger, but also to explore other feelings, such as happiness, fear, or bravery.",0,,
1093,"My monster no longer has control. Now that I know him, he can't come out whenever he wants. Only when I say he can.",0,,
1094,It was a very interesting workshop. It helped me learn more about me and how to express my anger in a healthy way.,0,,
1095,"My monster says, ëI don't want to hurt you.í",0,,
1096,I can keep my Feeling Friend next to my Monster and they can keep me calm.,0,,
1097,I want to make a difference in the world with my art and writing.,0,,
1098,This workshop is great because it encourages the children to look at where they have been in their lives and make goals for where they want to go.  It gets them thinking.,0,,
1099,I started my journey in such a dark place but I know that I am almost out of the tunnel because I can finally see my footprints.,0,,
1100,"I want my footprint to be a good one for the world. I want people to see me do good things, and then they will do good things too.",0,,
1101,"I feel stress every time I am at home, but I pretend I am happy so my mom doesn't worry.",0,,
1102,"Itís depressing to think about putting ones life back together after it's been shattered or broken. I now see that I can put my life back together through time, healing and perseverance.",0,,
1103,"I felt sure of myself, I am realizing  that life is beautiful, leaving the violence behind. I am beginning to see life through rose colored eyes. If feelings had colors then I could definitely see happiness as well as feel it.",0,,
1104,I think it is good to have similar feelings; it means that we are not alone.,0,,
1105,"They have the ability to see the missing broken pieces they carry.  They can see how everything and everyone is more then capable of putting themselves back together and heal through there own experiences. It's not the end to there world, it's only the beginning to a more realistic, honest, and loving world. They even saw missing parts that they didn't even know they had.",,,
\,,,,
,,,,
\,,,,
"Clients state that this workshop helped them see what they went through, what they need to heal, and what they really feel at this point in their life. Some say that they didn't even realize that they felt this way, or even see themselves in this matter.",0,,,
1106,It was rewarding to see children exchanging hearts and expressing their feeling and emotions to their peers.,0,,
1107,"Hands are for hugging, loving, helping, caring, and respecting.",0,,
1108,This was the first time in a very long time that I had a chance to enjoy myself.,0,,
1109,This workshop really helped me find a part of myself that I thought I had lost forever. I love this Windows group; it really helps me think positively about myself and my future.,0,,
1110,I haven't been able to think about my hopes in a very long time. It feels good.,0,,
1111,It feels so good to get to think about my hopes.,0,,
